id_artigo	id_autor	ano	titulo	texto
731	61	20150424	À luz do Telescópio Espacial Hubble	A luz do Sol permitiu e sustenta a vida na Terra. Mas foi a contemplação do céu nocturno que conduziu a vida feita inteligência ao assombro de compreender o Cosmos. A observação sistemática do céu nocturno é uma constante ao longo da história da humanidade, um pulsar da cultura humana. Contudo, a nossa visão, adaptada que está à luz solar, não possui a acuidade suficiente para perscrutar toda a riqueza escondida no céu nocturno. Para reduzir esta nossa miopia cósmica, Galileu Galileu, com a sua luneta, no início do século XVII, deu mais luz à nossa retina e permitiu a revolução científica e humanística que dele herdamos. A observação instrumental do Universo permitiu progressivamente compreender melhor o nosso lugar e a composição do Cosmos. Mas observar o céu a partir da Terra encontra uma limitação não ultrapassável mesmo com os mais modernos telescópios: a atmosfera, se por um lado protege a vida das perigosas radiações ultravioleta e raios cósmicos, por outro perturba e reduz a luz que nos chega das estrelas. “A atmosfera deixa de ser transparente para a luz de comprimento de onda abaixo de 300 nm (300 nanómetros), impedindo as observações no domínio do ultravioleta; permite a passagem da radiação visível mas deixa novamente de ser transparente para comprimentos de onda acima de cerca de 1100 nm, impedindo a observação no infravermelho longínquo”, diz-nos o astrónomo amador Guilherme de Almeida. E, como sabemos hoje, é importante observar o Universo para além da luz visível. Este problema levou gerações de astrónomos a sonhar com a colocação de um telescópio no espaço, a orbitar a Terra, para além da sua atmosfera. E, assim que a tecnologia o permitiu, um telescópio foi enviado ao encontro do conhecimento. Foi a 24 de Abril de 1990 que a NASA (www.nasa.gov) lançou, em colaboração com a ESA (www.esa.int/ESA), a bordo do vaivém espacial Discovery, o Telescópio Espacial Hubble (http://hubblesite.org/). Assim, este ano celebra-se o 25º aniversário deste telescópio assim designado para homenagear Edwin Powell Hubble (1889-1953), o astrónomo norte-americano que revolucionou a astronomia ao demonstrar, entre outras coisas, que as estrelas se afastam umas das outras a uma velocidade proporcional à distância que as separa, ou seja, que o Universo está em expansão. Com o Telescópio Espacial Hubble também o nosso conhecimento se expandiu como nunca antes. O Hubble ficou a orbitar a Terra a uma altitude de 552 km, perfazendo uma volta ao nosso planeta a cada 97 minutos. “Opticamente, o Hubble tem 2,40 m de abertura (diâmetro óptico útil), e funciona na configuração de Cassegrain, versão Ritchey-Chrétien”, especifica Guilherme de Almeida. Acima da atmosfera, o Hubble está ao abrigo da turbulência atmosférica e por isso consegue obter imagens limitadas apenas pela sua óptica e já não sujeitas às turbulências da atmosfera terrestre e, para além da radiação visível, podem fazer-se registos nos domínios do ultravioleta e do infravermelho. Esta possibilidade permitiu ao Hubble captar imagens deslumbrantes de galáxias, nebulosas e estrelas muito distantes com uma resolução ímpar que permite o seu estudo e interpretação científica. Ao longo destes 25 anos, a ciência feita com o Telescópio Espacial Hubble revolucionou o conhecimento de forma equiparável ao feito de Galileu há 500 anos. Este telescópio tornou-se um dos instrumentos mais produtivos ao dispor da comunidade científica, dando origem a mais de 10 mil artigos científicos. Para David Sobral, Investigador do I.A. - Faculdade de Ciências da Universidade de Lisboa, e do Observatório de Leiden, na Holanda, “o Hubble teve e tem uma importância incalculável para a Astronomia e Astrofísica. Ainda que não seja dos maiores telescópios que existe (tem “apenas” 2.4 metros), o facto de se encontrar numa órbita próxima foi incrivelmente importante, e já foram feitas 5 missões para “upgrade”. A primeira foi capaz de colocar o telescópio a funcionar com todo o seu potencial, mas ao longo dos anos, novos instrumentos fizeram com que o telescópio fosse ficando cada vez mais poderoso e competitivo. E hoje continua a ser dos mais concorridos e potentes. Com o Hubble é possível ver não só detalhes incríveis no nosso sistema solar e na nossa própria galáxia, mas também procurar e estudar as galáxias mais distantes alguma vez estudadas.” Este astrónomo português que faz investigações com o Hubble, destaca “a descoberta e estudo de galáxias a mais de 13 mil milhões de anos-luz”. Acrescenta que “talvez uma das grandes descobertas passou pela observação ultra-profunda de uma pequeníssima área do céu, dando-nos a imagem mais profunda alguma vez obtida pela humanidade. O Hubble mostrou que por mais pequena e negra seja uma área do céu, existem dezenas de milhares de galáxias, das mais variadas formas, cores e tamanhos.” Segundo João Fernandes, dirigente do Observatório Geofísico e Astronómico da Universidade de Coimbra, “o telescópio espacial Hubble tem sido um dos mais profícuos instrumentos astronómicos de sempre. A sua ”visão” leva-nos do Sistema Solar aos confins do Universo, passando por nebulosas, estrelas e galáxias. São milhares as fantásticas imagens que hoje povoam os livros e a internet que relatam as descobertas do Hubble. São, igualmente, inúmeros os artigos científicos e avanços do conhecimento do Espaço graças ao Hubble. É difícil escolher a observação ou descoberta mais importante. Pela proximidade com a Terra e pelas questões que a temática levantou (e levanta), João Fernandes destaca as observações que o Hubble fez de Plutão: “Plutão é hoje denominado um “planeta anão” (após a revisão da definição de “planeta” feita pela União Astronómica Internacional, em 2006) e tem um sistema de várias luas em seu redor. O Hubble fez das primeiras imagens da superfície de Plutão (http://hubblesite.org/gallery/album/pr2010006g/) como fez também descobertas de várias dessas luas. Apesar da “desqualificação” sofrida Plutão continua a atrair muito interesse pelo que nos pode informar sobre a formação e evolução do Sistema Solar.” “Portugal, enquanto membro pleno da ESA, tem hoje acesso total ao Hubble”, diz-nos David Sobral. “Qualquer investigador a trabalhar em Portugal pode fazer uma proposta e obter tempo para observar e responder a inúmeras perguntas. No entanto, e ainda que Hubble esteja a completar 25 anos, continua a ser altamente requisitado. Por exemplo, este ano foram novamente submetidas mais de 1300 propostas dos melhores investigadores do Mundo para realizar as mais diversas observações. Isso faz com que apenas uma em cada oito propostas tenham sucesso e sejam observadas. Eu próprio submeti duas propostas para observar galáxias distantes únicas que descobrimos recentemente e que se achava que não existiam. Vamos ficar a torcer para que daqui a alguns meses o Hubble as possa estudar como só o Hubble consegue, e para que Portugal possa usar um pouco mais as capacidades únicas do Hubble”. António Piedade
553	61	20140120	Quando não se sabia que o ADN era a molécula da hereditariedade	"A sigla ADN ultrapassou as fronteiras da genética e da biologia molecular e é hoje vulgar ouvirmos referências ao ADN nos órgãos de comunicação social a propósito das questões mais diversas. O ADN, ácido desoxirribonucleico, molécula da hereditariedade, imprime iconicamente uma dupla hélice no nosso olhar. É assim desde que Watson e Crick propuseram, em 1953, esse modelo helicoidal para a biomolécula dos genes. Como acontece com tudo na vida, a forma estrutural tem em si mesma significado funcional. A revolução científica que esta descoberta causou na biologia e na medicina, faz com que ela se confunda com a descoberta da molécula ADN. De facto, a substância ADN foi descoberta muito antes. Em 1869, o suíço Johann Friedrich Miescher (1844-1895) identificou uma nova substância ao analisar o conteúdo dos núcleos celulares dos glóbulos brancos. Essa substância era ácida e continha na sua composição fósforo, um elemento ausente nas proteínas. À nova substância, que não tinha propriedades proteicas, Miescher deu o nome de nucleína. Note-se que esta descoberta é efectuada numa época rica em revoluções na Biologia: em 1859, Darwin publica """"A Origem das Espécies""""; em 1865, Schwann e Scheiden postulam a teoria celular; ainda em 1865, Mendel publica o seu artigo sobre a hereditariedade, apesar de o mesmo ter tido pouca divulgação ou consideração. Há alguns factos curiosos ao redor da descoberta do ADN, assim como sobre o seu descobridor. Miescher formou-se em medicina na Universidade de Basileia. Contudo, uma surdez impediu-o de exercer medicina e optou por seguir uma carreira científica, influenciado pelo seu tio, professor de química fisiológica (hoje diríamos bioquímica) naquela universidade. A sua incapacidade auditiva não o impediu de ser um investigador com uma visão acutilante para os problemas científicos na sua área. De facto a sua descoberta teve implicações na biologia, na genética, na medicina, muito além daquilo que ele poderia suspeitar na época em que viveu. Miescher começou a sua carreira de investigação no laboratório de Felix Hoppe-Seyler (1825-1895), um dos mais prestigiados bioquímicos da época, que identificou e caracterizou a hemoglobina, entre outras proteínas. Situado no castelo de Tübingen, o laboratório ocupava as instalações de uma antiga lavandaria. A investigação nesse laboratório envolvia a identificação e caracterização do conteúdo proteico das células. Pensava-se que, uma vez identificadas todas as proteínas, se poderia compreender o funcionamento molecular da vida assim como a sua hereditariedade. Miescher começou, assim, a explorar as proteínas no citoplasma de glóbulos brancos que obtinha a partir do pus retido em ligaduras de feridas provenientes de um hospital vizinho. Para que o material biológico não se degradasse, mantinha a janela do laboratório aberta, o que fazia com que a temperatura de trabalho rondasse os 5 graus Celsius durante o Inverno! Apesar da sua persistência metodológica, cedo percebeu que existiam muitas mais proteínas no citoplasma dos glóbulos brancos do que aquelas que as técnicas analíticas de então permitiam identificar. Influenciado pelo eventual papel do núcleo na hereditariedade, uma ideia nova para a época, desenvolveu os protocolos necessários para isolar esse organelo celular e proceder à análise da sua composição. É então que Miescher verifica que está perante uma substância desconhecida à época, como já se disse. A estranheza por o núcleo não ser constituído maioritariamente por proteínas, levou a que o Hoppe-Seyler duvidasse dos resultados e obrigasse Miescher e outros investigadores a repetir a caracterização inúmeras vezes. Só em 1871, dois anos após a descoberta, é que Miescher publicaria os seus resultados numa revista científica. Ao longo da sua carreira científica, Miescher convenceu-se de que a nucleína não poderia ser a molécula responsável pela transmissão de caracteres hereditários e de que não estava envolvida na fecundação. Ademais, considerava que a nucleína deveria ser, devido ao seu enorme peso molecular, um repositório de matéria para a síntese de outras moléculas necessárias à vida. A composição aparentemente monótona da nucleína (mais tarde rebaptizada por ácido desoxirribonucleico, ou ADN) contrastava com a diversidade incontável das proteínas. E, à falta de outras evidências experimentais, os genes não poderiam ser feitos de uma substância tão pouco diversa, teriam de ser constituídos por proteínas. Esta ideia persistiu durante mais de 70 anos, até meados da década de 40 do século XX, altura em que ficou demonstrada experimentalmente que o ADN é a molécula dos genes. António Piedade"
955	61	20160930	Breve história da sonda Roseta	A sonda Roseta, da Agencia Espacial Europeia (ESA), finalizou no dia 30 de Setembro a sua missão de exploração do cometa 67P/Churyumov Gerasimenko. Depois de o ter explorado durante mais de dois anos, a sonda juntou-se ao cometa, na sua superfície, e segue agora com ele, silenciosa, na sua viagem cósmica. Mas antes de se desligar, antes do silêncio preparado, ao descer lenta e controladamente até à superfície do cometa a 3,24 quilómetros por hora, a sonda Roseta fez fotografias de muito alta resolução e recolheu dados completamente novos para a ciência sobre a composição dos gases e poeiras junto da superfície. Mas porquê colocar um fim à missão da Roseta? A ESA tomou esta decisão porque a sonda não foi preparada para suportar as temperaturas muito mais negativas que se verificam à medida que o cometa se afasta do Sol a uma velocidade de cerca de 40 mil quilómetros por hora. Para além de que, ao receber progressivamente uma menor radiação solar nos seus painéis solares, a sonda deixaria de ter a necessária energia eléctrica para poder funcionar. Recordemos que a sonda, com 2,8 metros de altura, 2900 quilos e dois painéis solares de 14 metros de comprimento, foi lançada da Terra a 2 de Março de 2004 transportando consigo o robô File. Nos dez anos seguintes, peregrinou pelos planetas interiores do Sistema Solar seguindo a trajectória calculada que a iria levar até ao cometa 67P/Churyumov Gerasimenko. A 8 de Junho de 2011, a Roseta entrou num período de hibernação que durou mais de dois anos e meio. Esta viagem adormecida foi necessária, uma que vez que a sonda se encontrava demasiado longe do Sol para poder captar a energia suficiente para se manter funcional. Mas a 19 de Janeiro de 2014, o relógio interno da Roseta acordou-a e a sonda enviou informações para o centro de controlo da ESA indicando que “estava bem” e pronta para a aproximação final ao cometa. O encontro ocorreu a 6 de Agosto de 2014 e a sonda ficou sob influência da gravidade do 67P/Churyumov Gerasimenko. A cerca de 540 milhões de quilómetros do Sol, algures entre Júpiter e Marte, a sonda enviou então as primeiras e fantásticas imagens do seu hospedeiro. Após alguns meses a analisar o cometa, foi escolhido o local para a descida do robô File até à sua superfície. Este momento histórico da exploração espacial ocorreu a 12 de Novembro de 2014. File tornou-se então no primeiro engenho humano a poisar num cometa. Apesar de ter ficado num local com pouca exposição solar, File conseguiu examinar o cometa durante 60 horas e enviar para a Roseta os dados recolhidos pelos vários instrumentos científicos. A sonda retransmitiu essa preciosa e inédita informação científica para a Terra. Desde então, a sonda Roseta continuou a captar informação sobre a actividade do cometa na aproximação deste ao Sol, examinando os materiais libertados e que testemunham a composição do Sistema Solar aquando da sua formação há 4600 milhões de anos. A 13 de Agosto de 2015, o cometa orbitado pela Roseta encontrou-se à distância de mínima de 186 milhões de quilómetros do Sol. Depois, começou o regresso e o começo do fim da missão. Os mais interessados podem consultar todos os detalhes da missão na página na internet que a ESA dedica à Roseta: http://www.esa.int/Our_Activities/Space_Science/Rosetta. E chegamos a 30 de Setembro de 2016 e ao fim da missão de exploração da Roseta. Mas, se a sonda adormece, o mesmo não vai acontecer com os cientistas que vão continuar a ter muito trabalho a estudar, durante os próximos anos, a enorme quantidade de dados recolhidos pela Roseta e pelo File. É como se estes tivessem escrito um livro que agora tem de ser descodificado e entendido pelos cientistas e que perdurará na história da ciência, contribuindo para uma melhor compreensão das origens, não só do Sistema Solar, como também da vida que nele se desenvolveu no planeta Terra. António Piedade
880	61	20160331	Vida sintética	A vida é fascinante! Apesar dos avanços espantosos nas biociências (Biologia, Bioquímica, entre outras) nas últimas décadas, muitas são as perguntas ainda sem resposta sobre o funcionamento da vida, sobre a sua origem neste planeta azul. E como é que os genes funcionam? Ainda pouco se sabe. Quando em 2003 a empresa Celera Genomics, liderada por J. Craig Venter, e o Consórcio Internacional do Projecto do Genoma Humano, liderado inicialmente por James Watson, divulgaram as suas cartografias do genoma do Homo sapiens sapiens, foi salientado por muitos cientistas que a tarefa hercúlea que acabara de ser concluída era só o princípio de um dilúvio de dúvidas, novas questões, novos desafios insuspeitos, algo genuinamente próprio da melhor ciência. A sequenciação, em si própria, não respondeu imediatamente a questões como o que é que a sequência diz (faz), qual o seu papel na orquestra dos mecanismos celulares, qual a semântica da hiperligação existente entre frases em parágrafos (genes) e capítulos (cromossomas) diferentes e que aparentam estar envolvidos em instruções para uma tarefa particular. É que as instruções genómicas para a vida parecem não ser muito lineares. Existem inúmeros exemplos em que a expressão de uma determinada característica resulta da comunicação entre genes localizados em cromossomas distintos. Ademais, há ainda a considerar, para a compreensão do funcionamento celular, a interacção de inúmeras moléculas e iões que banham e inundam as células, transportando ondas de ordens,informações vindas de outras células, muitas tendo origem e fim em órgãos diferentes nos seres multicelulares (o cérebro a controlar o movimento dos músculos com que o leitor folheia esta página, por exemplo). Muita da “habilidade” molecular em dar sentido a estas comunicações químicas está inscrita nos genes. Mas também é resultado das propriedades físico-químicas da interacção entre as biomoléculas. Espreitar esta complexidade ilustra a dificuldade em recriarmos a vida em laboratório para melhor a compreendermos. E sintetizar uma célula a partir dos seus blocos constituintes é uma tarefa em mãos por investigadores de alguns laboratórios, dos quais se tem destacado o do Instituto J. Craig Venter, nos Estados Unidos. Já em 2010, uma equipa de investigadores liderada por Craig Venter, naquele instituto, publicou na revista Science de 2 de Julho desse ano (http://www.sciencemag.org/cgi/content/abstract/science.1190719), que tinha conseguido reconstituir artificialmente e pela primeira vez, uma bactéria a partir das peças de “lego” bioquímicas. Nessa altura, os cientistas juntaram as unidades do ADN para montarem a sequência genética de uma bactéria tendo como ponto de partida o genoma da bactéria Mycoplasma mycoides. Foi o fruto, então, de 15 anos de bioengenharia laboriosa e deslumbrante, com um custo de 40 milhões de dólares. Agora, seis anos depois, a equipa de Craig Venter deu mais um passo em frente: os cientistas reduziram para metade o ADN da bactéria sintetizada em 2010, numa tentativa de se aproximarem de um genoma mínimo. Qual é o genoma mínimo necessário para uma célula crescer e dividir-se? De facto, um dos objectivos dos autores foi o de sintetizar uma célula o mais simples possível para que pudessem determinar a função molecular e biológica de cada um dos genes nela incluídos. Os resultados foram publicados num artigo da revista Science de 25 de Março último (http://science.sciencemag.org/content/351/6280/aad6253). Relembre-se que o genoma da nossa espécie tem cerca de 20 000 genes. O genoma designado por syn3.0, da bactéria agora sintetizada, tem só 473 genes. E este conjunto minimal de genes permite que as células cresçam e se dividam a cada três horas. Contudo, Craig Venter disse num comunicado da instituição que tem o seu nome que “32% dos genes essenciais para a vida desta célula têm uma função desconhecida, e muitos destes genes estão altamente conservados num grande número de espécies”. Assim, uma das conclusões é a de que há ainda muito para saber sobre como funcionam os genes mesmo nas células mais simples. Este grau de desconhecimento tem consequências bioéticas: “Quando apenas compreendemos dois terços da célula mais simples que conseguimos obter, então provavelmente compreendemos apenas 1% do genoma humano”, defende Clyde Hutchison, outro autor do estudo. Este foi mais um passo na longa caminhada que a ciência ainda tem a percorrer na compreensão de como funciona a vida! António Piedade
369	61	20130226	Abelhões sentem campos eléctricos das flores	Abraço o arco-íris com o olhar visível. A separação das componentes do espectro da luz solar, ao atravessarem as gotas de água, imprime na minha retina sensações de uma paleta de cores que o meu cérebro retém e compara com outras e anteriores sensações coloridas do mundo em que vivo. A cada nuance colorida o meu cérebro associa um nome e mesmo outras sensações de alegria, esperança, espanto, confiança, frio ou calor. As cores são elementos da minha comunicação com o mundo que me rodeia, têm um significado modulado pela cultura ocidental em que as aprendi. Mas há muito mais radiação para além da pequena região da luz que nos impressiona visivelmente no espectro da luz solar. Por exemplo, não conseguimos ver as radiações ultravioletas nem as infravermelhas. Também não conseguimos ver as radiofrequências nem as micro-ondas, e assim por adiante. Mas outros seres, que coabitam connosco este planeta, conseguem percepcionar a luz para além da região do espectro visível. Por exemplo, as abelhas conseguem ver cores ultra-violetas. Este facto levou o biólogo evolucionista Richard Dawkins a referir que para os insectos os campos de flores são “jardins no ultravioleta”. Se para a maioria de nós as pétalas do mal-me-quer são uniformemente brancas, para uma abelha há nelas uma outra riqueza de padrões coloridos que nós não conseguimos discernir. (É possível viver as diferenças que a radiação ultra-violeta causam no aspecto das flores na exposição permanente do Museu da Ciência da Universidade de Coimbra.) É o espelho da co-evolução entre as plantas com flor e os insectos que as polinizam. Ao longo de milhões de anos a evolução natural consertou as adaptações ajustando-as para uma comunicação mais eficaz e rica entre ambos. Mas a Natureza não para de nos espantar ou pelo menos o conhecimento que adquirimos sobre ela. Num trabalho publicado na edição de dia 22 de Fevereiro da revista Science mostra-se que pelo menos um dado tipo de abelhões (Bombus terrestris) é sensível à carga eléctrica, (ou melhor ao campo eléctrico) de uma dada flor. E que esta carga eléctrica da corola parece estar associada com o conteúdo em pólen que essa flor possui num dado momento. Os investigadores descobriram que, depois de uma flor ser visitada por uma abelhão, que lhe retira pólen, a sua carga eléctrica altera-se e esta mudança permanece durante alguns minutos. Assim, um outro abelhão, ao se aproximar dessa mesma flor, apercebe-se, provavelmente electrostaticamente, que o conteúdo em pólen é reduzido nesta. Talvez experiêncie a sensação de cabelos ou pelos em pé que nós próprios sentimos quando aproximamos, por exemplo, um braço de um superfície carregada electrostaticamente. Apesar de toda beleza cromática que apresenta para atrair o insecto, a flor não faz “publicidade enganosa” e comunica ao insecto que não vale a pena, naquele momento, ele nela poisar se ao pólen vem. O abelhão agradece, pois, como em outras actividades, nesta o tempo também é precioso. Para a flor, como também em outros casos, é importante dizer a verdade para que o insecto a ela volte noutra altura de mais abundância polínica. Para uma abelha um campo de flores não é só um jardim no ultravioleta. Este também está repleto de sensações electroestáticas que tornam a comunicação mais efectiva e rica de significados.
